Keyword,Intent,Volume,Trend,Keyword Difficulty,CPC (USD)
gravel driveway calculator,"Informational, Commercial",880,"0.25,0.31,0.16,0.16,0.37,0.37,0.68,0.68,1.00,0.52,0.52,0.46",25,0.32
gravel calculator for driveway,"Informational, Commercial",590,"0.30,0.56,0.24,0.30,0.37,0.44,0.56,1.00,0.56,0.56,0.24,0.37",35,0.32
driveway gravel calculator,"Informational, Commercial",390,"0.29,0.36,0.29,0.29,0.29,0.36,1.00,0.65,0.82,0.55,0.44,0.65",37,0.24
gravel driveway cost calculator,Informational,260,"0.53,0.53,0.53,0.67,0.67,0.67,0.80,1.00,0.80,0.67,0.67,0.67",33,1.76
calculate gravel for driveway,"Informational, Commercial",140,"0.28,0.52,0.28,0.33,0.52,0.43,1.00,1.00,0.28,0.20,0.52,0.28",57,0.24
how do i calculate gravel for driveway,Informational,140,"0.66,0.42,0.42,0.33,0.52,0.66,0.80,0.80,1.00,0.66,0.66,0.66",34,0.27
how to calculate gravel for driveway,Informational,110,"0.43,0.32,0.32,0.23,0.52,0.52,0.82,1.00,0.82,0.66,0.66,0.82",37,0.09
gravel calculator driveway,"Informational, Commercial",70,"1.00,0.21,0.28,0.21,0.12,0.00,0.15,0.21,0.12,0.15,0.21,0.21",37,0.24
gravel for driveway cost calculator,Informational,50,"0.44,0.27,0.27,0.00,1.00,1.00,0.37,0.27,0.81,0.37,0.08,0.17",28,1.76
calculate gravel driveway,Informational,30,"0.00,0.00,0.00,0.00,0.28,0.00,0.00,0.50,1.00,0.35,0.50,0.00",50,0.24
cost of gravel driveway calculator,Informational,30,"0.20,0.80,0.40,0.40,1.00,0.20,0.00,1.00,0.60,0.80,0.80,0.60",24,1.76
driveway calculator gravel,"Informational, Commercial",30,"0.11,0.11,0.00,0.00,0.00,0.00,0.55,0.44,1.00,0.77,0.55,0.00",32,0.24
how to calculate gravel for a driveway,Informational,30,"0.28,0.14,0.00,0.14,0.28,0.14,0.28,1.00,1.00,1.00,1.00,0.57",39,0.09
calculate amount of gravel needed for driveway,,20,"1.00,1.00,1.00,1.00,1.00,1.00,1.00,1.00,1.00,1.00,1.00,1.00",,0.00
calculate gravel needed for driveway,,20,"1.00,1.00,1.00,1.00,1.00,1.00,1.00,1.00,1.00,1.00,1.00,1.00",,0.00
calculate how much gravel for driveway,,20,"1.00,1.00,1.00,1.00,1.00,1.00,1.00,1.00,1.00,1.00,1.00,1.00",,0.00
calculate yards of gravel for driveway,,20,"1.00,1.00,1.00,1.00,1.00,1.00,1.00,1.00,1.00,1.00,1.00,1.00",,0.00
calculating gravel for driveway,,20,"0.00,0.06,0.00,0.00,0.06,0.00,0.28,0.00,0.00,1.00,0.33,0.28",,0.32
calculating yards of gravel for driveway,,20,"1.00,1.00,1.00,1.00,0.00,1.00,1.00,1.00,1.00,1.00,1.00,1.00",,0.00
driveway gravel calculator tons,,20,"1.00,1.00,0.00,1.00,1.00,1.00,1.00,1.00,1.00,1.00,1.00,1.00",,0.00
gravel driveway calculator tons,,20,"1.00,1.00,0.00,1.00,1.00,1.00,1.00,1.00,1.00,1.00,1.00,1.00",,0.00
gravel driveway estimate calculator,,20,"1.00,1.00,1.00,1.00,1.00,1.00,1.00,1.00,1.00,1.00,1.00,0.00",,0.00
gravel driveway material calculator,,20,"1.00,1.00,1.00,1.00,1.00,1.00,1.00,1.00,1.00,1.00,1.00,1.00",,0.00
gravel driveway stone calculator,,20,"1.00,1.00,1.00,0.00,1.00,1.00,1.00,1.00,1.00,1.00,1.00,1.00",,0.00
how much gravel do i need for my driveway calculator,,20,"1.00,1.00,1.00,1.00,1.00,1.00,1.00,1.00,1.00,1.00,1.00,1.00",,0.00
how much gravel for driveway calculator,,20,"1.00,1.00,1.00,1.00,1.00,1.00,1.00,1.00,1.00,1.00,1.00,1.00",,0.00
how to calculate amount of gravel for driveway,,20,"1.00,0.00,1.00,1.00,1.00,1.00,1.00,1.00,1.00,1.00,1.00,1.00",,0.00
how to calculate amount of gravel needed for driveway,,20,"1.00,1.00,1.00,1.00,1.00,1.00,1.00,1.00,1.00,1.00,1.00,1.00",,0.00
how to calculate gravel needed for driveway,,20,"1.00,1.00,1.00,1.00,1.00,1.00,1.00,1.00,1.00,1.00,1.00,1.00",,0.00
how to calculate how much gravel for a driveway,,20,"1.00,0.00,1.00,0.00,1.00,1.00,1.00,1.00,1.00,1.00,1.00,1.00",,0.00
how to calculate how much gravel for driveway,,20,"1.00,1.00,1.00,1.00,1.00,1.00,1.00,1.00,1.00,1.00,1.00,1.00",,0.00
how to calculate how much gravel needed for driveway,,20,"1.00,1.00,1.00,0.00,1.00,1.00,1.00,1.00,1.00,1.00,0.00,1.00",,0.00
how to calculate yards of gravel for driveway,,20,"1.00,1.00,1.00,1.00,1.00,1.00,1.00,1.00,1.00,1.00,1.00,1.00",,0.00
calculate how much gravel needed for driveway,,10,"0.00,0.00,0.00,0.00,0.00,1.00,1.00,1.00,1.00,1.00,1.00,1.00",,0.00
calculator for gravel driveway,,10,"0.12,0.12,0.29,0.00,0.12,0.29,1.00,0.12,0.00,0.00,0.00,0.00",,0.32
gravel driveway base calculator,,10,"1.00,0.00",,0.00
gravel driveway calculator uk,,10,"1.00,1.00,0.00,0.00,1.00,0.00,1.00,1.00,0.00,0.00,0.00,0.00",,0.00
gravel driveway cost calculator australia,,10,"1.00,0.00,0.00,0.00,1.00,0.00,0.00,0.00,0.00,1.00,0.00,0.00",,0.00
gravel driveway cost calculator canada,,10,"0.00,0.25,0.00,0.00,0.00,0.25,1.00,0.00,0.25,0.50,0.00,0.50",,0.00
gravel driveway cost calculator uk,,10,"0.00,0.00,1.00,1.00,0.00,0.00,0.00,0.00,1.00,0.00,1.00,1.00",,0.00
gravel for driveway calculator,,10,"0.17,0.00,0.00,0.00,1.00,0.00,0.33,0.00,0.00,0.00,0.00,0.17",,0.32
how much gravel do i need for a driveway calculator,,10,"0.00,1.00,0.00,1.00,0.00,1.00,1.00,1.00,0.00,0.00,0.00,1.00",,0.00
how much gravel for 100 ft driveway calculator,,10,"0.00,0.00,1.00,1.00",,0.00
how to calculate driveway gravel,,10,"0.00,0.78,0.00,0.00,0.00,0.00,0.00,0.11,0.11,1.00,0.00,0.00",,0.09
20mm driveway gravel calculator,,0,"0.00,0.00,0.00,0.00,0.00,0.00,0.00,0.00,0.00,0.00,0.00,0.00",,0.00
calculate cubic feet of gravel for a driveway,,0,"0.00,0.00,0.00,0.00,0.00,0.00,0.00,0.00,0.00,0.00,0.00,0.00",,0.00
calculate driveway gravel,,0,"0.00,0.00,0.00,0.00,0.00,0.00,0.00,0.00,1.00,0.00,0.00,0.00",,0.32
calculate driveway gravel in tons,,0,"0.00,0.00,0.00,0.00,0.00,0.00,0.00,0.00,0.00,0.00,0.00,0.00",,0.00
calculate driveway gravel needed,,0,"0.00,0.00,0.00,0.00,0.00,0.00,0.00,0.00,0.00,0.00,0.00,0.00",,0.00
calculate how much gravel for a driveway,,0,"0.00,0.00,0.00,0.00,0.00,0.00,0.00,0.00,0.00,0.00,0.00,0.00",,0.00
calculating driveway gravel,,0,"0.00,0.00,0.00,0.00,0.00,0.00,1.00,0.00,0.00,0.00,0.00,0.00",,0.32
calculating gravel driveway sq foot cost,,0,"0.00,0.00,0.00,0.00,0.00,0.00,0.00,0.00,0.00,0.00,0.00,0.00",,0.00
calculating gravel needed for driveway,,0,"0.00,0.00,0.00,0.00,0.00,0.00,0.00,0.00,0.00,0.00,0.00,0.00",,0.00
calculating how much gravel you need for your driveway,,0,"0.00,0.00,0.00,0.00,0.00,0.00,0.00,0.00,0.00,0.00,0.00,0.00",,0.00
calculator to determine a gravel driveway,,0,"0.00,0.00,0.00,0.00,0.00,0.00,0.00,0.00,0.00,0.00,0.00,0.00",,0.00
clay gravel calculator for driveway,,0,"0.00,0.00,0.00,0.00,0.00,0.00,0.00,0.00,0.00,0.00,0.00,0.00",,0.00
cost calculator to install gravel driveway,,0,"0.00,0.00,0.00,0.00,0.00,0.00,0.00,0.00,0.00,0.00,0.00,0.00",,0.00
cost gravel driveway calculator,,0,"0.00,0.00,0.00,0.00,0.00,0.00,0.00,1.00,0.00,0.00,0.00,0.00",,1.05
cost gravel vs asphalt driveway calculator,,0,"0.00,0.00,0.00,0.00,0.00,0.00,0.00,0.00,0.00,0.00,0.00,0.00",,0.00
cost of gravel driveway calculator uk,,0,"0.00,0.00,0.00,0.00,0.00,0.00,0.00,0.00,0.00,0.00,0.00,0.00",,0.00
driveway cost calculator gravel,,0,"0.00,0.00,0.00,0.00,0.00,0.00,0.00,0.00,0.00,0.00,0.00,0.00",,0.00
driveway gravel calculation,,0,"0.00,0.00,0.00,0.00,0.00,0.00,0.00,0.00,0.00,0.00,0.00,0.00",,0.00
driveway gravel calculator uk,,0,"0.00,0.00,0.00,0.00,0.00,0.00,0.00,0.00,0.00,0.00,0.00,0.00",,0.00
driveway gravel cost calculator,,0,"0.00,0.00,0.00,0.00,0.00,0.00,0.00,0.00,0.00,0.00,0.00,0.00",,0.00
gravel calculator for a driveway,,0,"0.00,0.00,0.00,0.00,0.00,0.00,0.00,0.00,0.00,0.00,0.00,0.00",,0.00
gravel driveway calculations,,0,"0.00,0.00,0.00,0.00,0.00,0.00,0.00,0.00,0.00,0.00,0.00,0.00",,0.00
gravel driveway calculator cost,,0,"0.50,1.00,0.00,0.00,0.00,0.00,0.00,0.00,0.00,0.00,0.00,0.00",,1.05
gravel driveway calculator pea gravel,,0,"0.00,0.00,0.00,0.00,0.00,0.00,0.00,0.00,0.00,0.00,0.00,0.00",,0.00
gravel driveway calculator yards,,0,"0.00,0.00,0.00,0.00,0.00,0.00,0.00,0.00,0.00,0.00,0.00,1.00",,0.00
gravel driveway costs calculator,,0,"0.00,0.00,0.00,0.00,0.00,0.00,0.00,0.00,0.00,0.00,0.00,0.00",,1.05
gravel driveway gravel calculator,,0,"0.00,0.00,0.00,0.00,0.00,0.00,0.00,0.00,0.00,0.00,0.00,0.00",,0.00
gravel driveway leveling cost calculator,,0,"0.00,0.00,0.00,0.00,0.00,0.00,0.00,0.00,0.00,0.00,0.00,0.00",,0.00
gravel driveway price calculator,,0,"0.00,0.00,0.00,0.00,0.00,0.00,0.00,0.00,0.00,0.00,0.00,0.00",,0.00
gravel driveway repair cost calculator,,0,"0.00,0.00,0.00,0.00,0.00,0.00,0.00,0.00,0.00,0.00,0.00,0.00",,0.00
gravel driveway square feet calculator,,0,"0.00,0.00,0.00,0.00,0.00,0.00,0.00,0.00,0.00,0.00,0.00,0.00",,0.00
gravel driveway yard calculator,,0,"0.00,0.00,0.00,0.00,0.00,0.00,0.00,0.00,0.00,0.00,0.00,0.00",,0.00
how do i calculate the cost of gravel driveway,,0,"0.00,0.00,0.00,0.00,0.00,0.00,0.00,0.00,0.00,0.00,0.00,0.00",,0.00
how to calculate a gravel driveway,,0,"0.00,0.00,0.00,0.00,0.00,0.00,0.00,0.00,0.00,0.00,0.00,0.00",,0.00
how to calculate cost of a gravel driveway,,0,"0.00,0.00,0.00,0.00,0.00,0.00,0.00,0.00,0.00,0.00,0.00,0.00",,0.00
how to calculate how much gravel i need for driveway,,0,"0.00,0.00,0.00,0.00,0.00,0.00,0.00,0.00,0.00,0.00,0.00,0.00",,0.00
pea gravel driveway calculator,,0,"0.00,0.00,0.00,0.00,0.00,0.00,0.00,0.00,0.00,0.00,0.00,0.00",,0.00
pea gravel driveway cost calculator,,0,"0.00,0.00,0.00,0.00,0.00,0.00,0.00,0.00,0.00,0.00,0.00,0.00",,0.00
